{
  "tenant_id": "11111111-1111-4111-8111-111111111111",
  "company_id": "22222222-2222-4222-8222-222222222222",
  "journal_date": "2026-07-25",
  "currency": "USD",
  "status": "draft",
  "lines": [
    {
      "account_id": "33333333-3333-4333-8333-333333333333",
      "debit": 125000.0,
      "credit": 0,
      "project_id": "44444444-4444-4444-8444-444444444444"
    },
    {
      "account_id": "55555555-5555-4555-8555-555555555555",
      "debit": 0,
      "credit": 125000.0,
      "project_id": "44444444-4444-4444-8444-444444444444"
    }
  ]
}